{
  "recipe": {
    "id": "full-english-breakfast",
    "title": "Full English Breakfast",
    "description": "Classic British breakfast with all the trimmings",
    "estimated_total": "PT30M",
    "locale": "en",
    "source": "pdf",
    "servings": 4,
    "difficulty": "Not Too Tricky",
    "tags": [
      "pork",
      "quick",
      "dessert",
      "breakfast"
    ],
    "course": "dessert"
  },
  "ingredients": [
    {
      "id": "rashers",
      "name": "rashers",
      "quantity": 8.0,
      "unit": "bacon"
    },
    {
      "id": "8_sausages",
      "name": "8 sausages",
      "quantity": null,
      "unit": null
    },
    {
      "id": "4_eggs",
      "name": "4 eggs",
      "quantity": null,
      "unit": null
    },
    {
      "id": "tinned_baked_beans",
      "name": "tinned baked beans",
      "quantity": 400.0,
      "unit": "g"
    },
    {
      "id": "4_tomatoes_halved",
      "name": "4 tomatoes, halved",
      "quantity": null,
      "unit": null
    },
    {
      "id": "mushrooms",
      "name": "mushrooms",
      "quantity": 200.0,
      "unit": "g"
    },
    {
      "id": "bread",
      "name": "bread",
      "quantity": 4.0,
      "unit": "slices"
    },
    {
      "id": "black_pudding_optional",
      "name": "Black pudding (optional)",
      "quantity": null,
      "unit": null
    }
  ],
  "utensils": [],
  "steps": [
    {
      "id": "grill_sausages_bacon",
      "descr": "Grill sausages and bacon until cooked",
      "instructions": "Grill sausages and bacon until cooked",
      "type": "immediate",
      "auto_start": true,
      "requires_confirm": true,
      "depends_on": [],
      "next": [
        "fry_mushrooms_tomatoes"
      ],
      "on_enter": [
        {
          "say": "Right, let's get those sausages and bacon grilling. We want them to be sizzling and nicely browned."
        }
      ]
    },
    {
      "id": "fry_mushrooms_tomatoes",
      "descr": "Fry mushrooms and tomatoes",
      "instructions": "Fry mushrooms and tomatoes",
      "type": "immediate",
      "auto_start": false,
      "requires_confirm": true,
      "depends_on": [
        "grill_sausages_bacon"
      ],
      "next": [
        "heat_baked_beans"
      ],
      "on_enter": [
        {
          "say": "Now, let's fry those mushrooms and tomatoes. They'll soften up beautifully and add a lovely flavour."
        }
      ]
    },
    {
      "id": "heat_baked_beans",
      "descr": "Heat baked beans in a pan",
      "instructions": "Heat baked beans in a pan",
      "type": "immediate",
      "auto_start": false,
      "requires_confirm": true,
      "depends_on": [
        "fry_mushrooms_tomatoes"
      ],
      "next": [
        "cook_eggs"
      ],
      "on_enter": [
        {
          "say": "Let's warm up those baked beans until they're nice and hot. They'll be the perfect accompaniment."
        }
      ]
    },
    {
      "id": "cook_eggs",
      "descr": "Fry or scramble eggs to preference",
      "instructions": "Fry or scramble eggs to preference",
      "type": "immediate",
      "auto_start": false,
      "requires_confirm": true,
      "depends_on": [
        "heat_baked_beans"
      ],
      "next": [
        "toast_bread"
      ],
      "on_enter": [
        {
          "say": "Time to cook the eggs just the way you like them. Whether it's a fry-up or a scramble, make them your own."
        }
      ]
    },
    {
      "id": "toast_bread",
      "descr": "Toast bread",
      "instructions": "Toast bread",
      "type": "immediate",
      "auto_start": false,
      "requires_confirm": true,
      "depends_on": [
        "cook_eggs"
      ],
      "next": [
        "arrange_on_plates"
      ],
      "on_enter": [
        {
          "say": "Let's get that bread toasting until it's golden and crispy. Perfect for mopping up all those lovely flavours."
        }
      ]
    },
    {
      "id": "arrange_on_plates",
      "descr": "Arrange everything on plates",
      "instructions": "Arrange everything on plates",
      "type": "immediate",
      "auto_start": false,
      "requires_confirm": true,
      "depends_on": [
        "toast_bread"
      ],
      "next": [
        "serve_with_tea_coffee"
      ],
      "on_enter": [
        {
          "say": "Now, let's arrange everything beautifully on the plates. It's going to look fantastic!"
        }
      ]
    },
    {
      "id": "serve_with_tea_coffee",
      "descr": "Serve with tea or coffee",
      "instructions": "Serve with tea or coffee",
      "type": "immediate",
      "auto_start": false,
      "requires_confirm": false,
      "depends_on": [
        "arrange_on_plates"
      ],
      "next": [],
      "on_enter": [
        {
          "say": "Finally, serve it up with a nice cup of tea or coffee. Enjoy your brilliant full English breakfast!"
        }
      ]
    }
  ],
  "events": {
    "tts_voice": "chef_friendly",
    "reminder_default": {
      "every": "PT30S"
    }
  },
  "notes": {
    "text": "Use the oven to keep things warm\nQuality sausages make all the difference\nPerfect weekend treat"
  }
}