{
  "recipe": {
    "id": "pesto-pasta",
    "title": "Pesto Pasta",
    "description": "Simple pasta with fresh basil pesto and Parmesan",
    "estimated_total": "PT20M",
    "locale": "en",
    "source": "pdf",
    "servings": 4,
    "difficulty": "Not Too Tricky",
    "tags": [
      "pasta",
      "italian"
    ],
    "course": "main",
    "cuisine": "italian"
  },
  "ingredients": [
    {
      "id": "pasta",
      "name": "pasta",
      "quantity": 400.0,
      "unit": "g"
    },
    {
      "id": "fresh_basil",
      "name": "fresh basil",
      "quantity": 100.0,
      "unit": "g"
    },
    {
      "id": "pine_nuts",
      "name": "pine nuts",
      "quantity": 50.0,
      "unit": "g"
    },
    {
      "id": "cloves",
      "name": "cloves",
      "quantity": 2.0,
      "unit": "garlic"
    },
    {
      "id": "parmesan_grated",
      "name": "Parmesan, grated",
      "quantity": 100.0,
      "unit": "g"
    },
    {
      "id": "olive_oil",
      "name": "olive oil",
      "quantity": 150.0,
      "unit": "ml"
    },
    {
      "id": "salt_and_pepper",
      "name": "Salt and pepper",
      "quantity": null,
      "unit": null
    },
    {
      "id": "cherry_tomatoes",
      "name": "Cherry tomatoes",
      "quantity": null,
      "unit": null
    }
  ],
  "utensils": [],
  "steps": [
    {
      "id": "cook_pasta",
      "descr": "Cook pasta in salted boiling water",
      "instructions": "Cook pasta in salted boiling water",
      "type": "timer",
      "duration": "PT10M",
      "auto_start": true,
      "requires_confirm": true,
      "depends_on": [],
      "next": [
        "blend_pesto"
      ],
      "on_enter": [
        {
          "say": "Right, let's get started by cooking the pasta in a big pot of salted boiling water. Give it about ten minutes until it's al dente."
        }
      ]
    },
    {
      "id": "blend_pesto",
      "descr": "Blend basil, pine nuts, garlic, and Parmesan",
      "instructions": "Blend basil, pine nuts, garlic, and Parmesan",
      "type": "immediate",
      "auto_start": false,
      "requires_confirm": true,
      "depends_on": [
        "cook_pasta"
      ],
      "next": [
        "drizzle_olive_oil"
      ],
      "on_enter": [
        {
          "say": "Now, let's make that beautiful pesto. Pop the basil, pine nuts, garlic, and Parmesan into a blender. Give it a whizz until it's nice and smooth."
        }
      ]
    },
    {
      "id": "drizzle_olive_oil",
      "descr": "Drizzle in olive oil while blending",
      "instructions": "Drizzle in olive oil while blending",
      "type": "immediate",
      "auto_start": false,
      "requires_confirm": true,
      "depends_on": [
        "blend_pesto"
      ],
      "next": [
        "season_pesto"
      ],
      "on_enter": [
        {
          "say": "Brilliant! Now, while the blender is running, slowly drizzle in the olive oil. This will give your pesto that lovely, silky texture."
        }
      ]
    },
    {
      "id": "season_pesto",
      "descr": "Season pesto with salt and pepper",
      "instructions": "Season pesto with salt and pepper",
      "type": "immediate",
      "auto_start": false,
      "requires_confirm": true,
      "depends_on": [
        "drizzle_olive_oil"
      ],
      "next": [
        "reserve_drain_pasta"
      ],
      "on_enter": [
        {
          "say": "Let's season our pesto with a pinch of salt and a crack of black pepper. Taste it and adjust as you like."
        }
      ]
    },
    {
      "id": "reserve_drain_pasta",
      "descr": "Reserve pasta water, drain pasta",
      "instructions": "Reserve pasta water, drain pasta",
      "type": "immediate",
      "auto_start": false,
      "requires_confirm": true,
      "depends_on": [
        "season_pesto"
      ],
      "next": [
        "toss_pasta_pesto"
      ],
      "on_enter": [
        {
          "say": "Right, let's reserve a cup of that starchy pasta water, then drain the pasta. This water will help us loosen the pesto later."
        }
      ]
    },
    {
      "id": "toss_pasta_pesto",
      "descr": "Toss pasta with pesto, add pasta water to loosen",
      "instructions": "Toss pasta with pesto, add pasta water to loosen",
      "type": "immediate",
      "auto_start": false,
      "requires_confirm": true,
      "depends_on": [
        "reserve_drain_pasta"
      ],
      "next": [
        "serve_with_tomatoes"
      ],
      "on_enter": [
        {
          "say": "Now, let's toss the pasta with that gorgeous pesto. Add a splash of the reserved pasta water to get it to the perfect consistency."
        }
      ]
    },
    {
      "id": "serve_with_tomatoes",
      "descr": "Serve with halved cherry tomatoes and extra Parmesan",
      "instructions": "Serve with halved cherry tomatoes and extra Parmesan",
      "type": "immediate",
      "auto_start": false,
      "requires_confirm": false,
      "depends_on": [
        "toss_pasta_pesto"
      ],
      "next": [],
      "on_enter": [
        {
          "say": "Finally, let's plate up! Serve your pasta with some halved cherry tomatoes and a sprinkle of extra Parmesan. Enjoy your meal!"
        }
      ]
    }
  ],
  "events": {
    "tts_voice": "chef_friendly",
    "reminder_default": {
      "every": "PT30S"
    }
  },
  "notes": {
    "text": "Toast pine nuts for deeper flavor\nPesto can be made ahead and frozen\nAdd a splash of lemon juice for brightness"
  }
}