{
  "recipe": {
    "id": "french-toast",
    "title": "French Toast",
    "description": "Golden eggy bread with cinnamon and maple syrup",
    "estimated_total": "PT15M",
    "locale": "en",
    "source": "pdf",
    "servings": 4,
    "difficulty": "Not Too Tricky",
    "tags": [
      "breakfast"
    ],
    "course": "breakfast",
    "cuisine": "french"
  },
  "ingredients": [
    {
      "id": "slices_bread",
      "name": "slices bread",
      "quantity": 8.0,
      "unit": "thick"
    },
    {
      "id": "4_eggs",
      "name": "4 eggs",
      "quantity": null,
      "unit": null
    },
    {
      "id": "milk",
      "name": "milk",
      "quantity": 150.0,
      "unit": "ml"
    },
    {
      "id": "cinnamon",
      "name": "cinnamon",
      "quantity": 1.0,
      "unit": "tsp"
    },
    {
      "id": "vanilla_extract",
      "name": "vanilla extract",
      "quantity": 1.0,
      "unit": "tsp"
    },
    {
      "id": "butter_for_frying",
      "name": "Butter for frying",
      "quantity": null,
      "unit": null
    },
    {
      "id": "maple_syrup_and_berries",
      "name": "Maple syrup and berries",
      "quantity": null,
      "unit": null
    }
  ],
  "utensils": [],
  "steps": [
    {
      "id": "whisk_ingredients",
      "descr": "Whisk eggs, milk, cinnamon, and vanilla",
      "instructions": "Whisk eggs, milk, cinnamon, and vanilla",
      "type": "immediate",
      "auto_start": true,
      "requires_confirm": true,
      "depends_on": [],
      "next": [
        "dip_bread"
      ],
      "on_enter": [
        {
          "say": "Right, let's whisk together the eggs, milk, cinnamon, and vanilla until it's all beautifully combined."
        }
      ]
    },
    {
      "id": "dip_bread",
      "descr": "Dip bread slices in egg mixture",
      "instructions": "Dip bread slices in egg mixture",
      "type": "immediate",
      "auto_start": false,
      "requires_confirm": true,
      "depends_on": [
        "whisk_ingredients"
      ],
      "next": [
        "heat_butter"
      ],
      "on_enter": [
        {
          "say": "Now, let's dip those lovely thick slices of bread into our eggy mixture. Make sure they're nicely coated but not too soggy."
        }
      ]
    },
    {
      "id": "heat_butter",
      "descr": "Heat butter in a pan",
      "instructions": "Heat butter in a pan",
      "type": "immediate",
      "auto_start": false,
      "requires_confirm": true,
      "depends_on": [
        "dip_bread"
      ],
      "next": [
        "fry_bread"
      ],
      "on_enter": [
        {
          "say": "Let's get that butter melting in the pan. You want it to sizzle gently, not burn."
        }
      ]
    },
    {
      "id": "fry_bread",
      "descr": "Fry bread until golden on both sides",
      "instructions": "Fry bread until golden on both sides",
      "type": "immediate",
      "auto_start": false,
      "requires_confirm": true,
      "depends_on": [
        "heat_butter"
      ],
      "next": [
        "keep_warm"
      ],
      "on_enter": [
        {
          "say": "Time to fry the bread. We're looking for a gorgeous golden colour on both sides. You'll know it's ready when it smells divine."
        }
      ]
    },
    {
      "id": "keep_warm",
      "descr": "Keep warm in oven while cooking remaining slices",
      "instructions": "Keep warm in oven while cooking remaining slices",
      "type": "immediate",
      "auto_start": false,
      "requires_confirm": true,
      "depends_on": [
        "fry_bread"
      ],
      "next": [
        "stack_plates"
      ],
      "on_enter": [
        {
          "say": "Let's pop those golden beauties in the oven to keep warm while we cook the rest."
        }
      ]
    },
    {
      "id": "stack_plates",
      "descr": "Stack on plates",
      "instructions": "Stack on plates",
      "type": "immediate",
      "auto_start": false,
      "requires_confirm": true,
      "depends_on": [
        "keep_warm"
      ],
      "next": [
        "drizzle_syrup"
      ],
      "on_enter": [
        {
          "say": "Right, let's stack those slices up on the plates. Looking good already!"
        }
      ]
    },
    {
      "id": "drizzle_syrup",
      "descr": "Drizzle with maple syrup and top with fresh berries",
      "instructions": "Drizzle with maple syrup and top with fresh berries",
      "type": "immediate",
      "auto_start": false,
      "requires_confirm": false,
      "depends_on": [
        "stack_plates"
      ],
      "next": [],
      "on_enter": [
        {
          "say": "Now for the finishing touch - drizzle over some lovely maple syrup and top with fresh berries. Absolutely delicious!"
        }
      ]
    }
  ],
  "events": {
    "tts_voice": "chef_friendly",
    "reminder_default": {
      "every": "PT30S"
    }
  },
  "notes": {
    "text": "Stale bread works best. Don't oversoak or bread will fall apart. Add a pinch of nutmeg for extra flavor."
  }
}