{
  "recipe": {
    "id": "beef-kebabs",
    "title": "Beef Kebabs",
    "description": "Marinated beef skewers grilled to perfection",
    "estimated_total": "PT40M",
    "locale": "en",
    "source": "pdf",
    "servings": 4,
    "difficulty": "Not Too Tricky",
    "tags": [
      "beef"
    ],
    "course": "main",
    "cuisine": "greek"
  },
  "ingredients": [
    {
      "id": "beef_sirloin_cubed",
      "name": "beef sirloin, cubed",
      "quantity": 600.0,
      "unit": "g"
    },
    {
      "id": "peppers_chunked",
      "name": "peppers, chunked",
      "quantity": 2.0,
      "unit": "bell"
    },
    {
      "id": "onion_chunked",
      "name": "onion, chunked",
      "quantity": 1.0,
      "unit": "red"
    },
    {
      "id": "olive_oil",
      "name": "olive oil",
      "quantity": 3.0,
      "unit": "tbsp"
    },
    {
      "id": "cumin",
      "name": "cumin",
      "quantity": 2.0,
      "unit": "tsp"
    },
    {
      "id": "paprika",
      "name": "paprika",
      "quantity": 2.0,
      "unit": "tsp"
    },
    {
      "id": "lemon_juice",
      "name": "Lemon juice",
      "quantity": null,
      "unit": null
    },
    {
      "id": "flatbread_and_tzatziki",
      "name": "Flatbread and tzatziki",
      "quantity": null,
      "unit": null
    }
  ],
  "utensils": [],
  "steps": [
    {
      "id": "mix_marinade",
      "descr": "Mix olive oil, cumin, paprika, lemon juice",
      "instructions": "Mix olive oil, cumin, paprika, lemon juice",
      "type": "immediate",
      "auto_start": true,
      "requires_confirm": true,
      "depends_on": [],
      "next": [
        "marinate_beef"
      ],
      "on_enter": [
        {
          "say": "Right, let's get started by mixing the olive oil, cumin, paprika, and a good squeeze of lemon juice. This is going to be the flavor base for our beef."
        }
      ]
    },
    {
      "id": "marinate_beef",
      "descr": "Marinate beef for at least 2 hours",
      "instructions": "Marinate beef for at least 2 hours",
      "type": "timer",
      "duration": "PT2H",
      "auto_start": false,
      "requires_confirm": true,
      "depends_on": [
        "mix_marinade"
      ],
      "next": [
        "thread_skewers"
      ],
      "on_enter": [
        {
          "say": "Now, let's marinate the beef for at least two hours. This will really let those flavors soak in beautifully."
        }
      ]
    },
    {
      "id": "thread_skewers",
      "descr": "Thread beef, peppers, and onion onto skewers",
      "instructions": "Thread beef, peppers, and onion onto skewers",
      "type": "immediate",
      "auto_start": false,
      "requires_confirm": true,
      "depends_on": [
        "marinate_beef"
      ],
      "next": [
        "preheat_grill"
      ],
      "on_enter": [
        {
          "say": "Let's get those skewers ready. Thread the marinated beef, peppers, and onion onto the skewers. Make sure to alternate them for a lovely mix."
        }
      ]
    },
    {
      "id": "preheat_grill",
      "descr": "Preheat grill to high",
      "instructions": "Preheat grill to high",
      "type": "immediate",
      "auto_start": false,
      "requires_confirm": true,
      "depends_on": [
        "thread_skewers"
      ],
      "next": [
        "grill_kebabs"
      ],
      "on_enter": [
        {
          "say": "Let's preheat the grill to high. We want it nice and hot to get a good sear on those kebabs."
        }
      ]
    },
    {
      "id": "grill_kebabs",
      "descr": "Grill kebabs 10-12 minutes, turning often",
      "instructions": "Grill kebabs 10-12 minutes, turning often",
      "type": "timer",
      "duration": "PT12M",
      "auto_start": false,
      "requires_confirm": true,
      "depends_on": [
        "preheat_grill"
      ],
      "next": [
        "rest_kebabs"
      ],
      "on_enter": [
        {
          "say": "Time to grill the kebabs. Let's cook them for ten to twelve minutes, turning often to get that lovely char all around."
        }
      ]
    },
    {
      "id": "rest_kebabs",
      "descr": "Let rest 5 minutes",
      "instructions": "Let rest 5 minutes",
      "type": "timer",
      "duration": "PT5M",
      "auto_start": false,
      "requires_confirm": true,
      "depends_on": [
        "grill_kebabs"
      ],
      "next": [
        "serve_kebabs"
      ],
      "on_enter": [
        {
          "say": "Brilliant! Let the kebabs rest for about five minutes. This is really important to let all those lovely juices redistribute."
        }
      ]
    },
    {
      "id": "serve_kebabs",
      "descr": "Serve with flatbread and tzatziki",
      "instructions": "Serve with flatbread and tzatziki",
      "type": "immediate",
      "auto_start": false,
      "requires_confirm": false,
      "depends_on": [
        "rest_kebabs"
      ],
      "next": [],
      "on_enter": [
        {
          "say": "Time to serve up! Enjoy these delicious kebabs with some flatbread and a dollop of tzatziki. Absolutely fantastic!"
        }
      ]
    }
  ],
  "events": {
    "tts_voice": "chef_friendly",
    "reminder_default": {
      "every": "PT30S"
    }
  },
  "notes": {
    "text": "Soak wooden skewers to prevent burning\nCut everything the same size for even cooking\nDon't overcook the beef"
  }
}