{
  "recipe": {
    "id": "pulled-pork-sandwich",
    "title": "Pulled Pork Sandwich",
    "description": "Slow-cooked tender pork with BBQ sauce on a soft bun",
    "estimated_total": "PT6H",
    "locale": "en",
    "source": "pdf",
    "servings": 8,
    "difficulty": "Medium",
    "tags": [
      "pork"
    ],
    "course": "main",
    "cuisine": "american"
  },
  "ingredients": [
    {
      "id": "pork_shoulder",
      "name": "pork shoulder",
      "quantity": 2.0,
      "unit": "kg"
    },
    {
      "id": "paprika",
      "name": "paprika",
      "quantity": 2.0,
      "unit": "tbsp"
    },
    {
      "id": "brown_sugar",
      "name": "brown sugar",
      "quantity": 2.0,
      "unit": "tbsp"
    },
    {
      "id": "garlic_powder",
      "name": "garlic powder",
      "quantity": 1.0,
      "unit": "tbsp"
    },
    {
      "id": "bbq_sauce",
      "name": "BBQ sauce",
      "quantity": 300.0,
      "unit": "ml"
    },
    {
      "id": "buns",
      "name": "buns",
      "quantity": 8.0,
      "unit": "burger"
    },
    {
      "id": "coleslaw_for_topping",
      "name": "Coleslaw for topping",
      "quantity": null,
      "unit": null
    }
  ],
  "utensils": [],
  "steps": [
    {
      "id": "mix_spice_rub",
      "descr": "Mix paprika, brown sugar, garlic powder, salt, pepper for rub",
      "instructions": "Mix paprika, brown sugar, garlic powder, salt, pepper for rub",
      "type": "immediate",
      "auto_start": true,
      "requires_confirm": true,
      "depends_on": [],
      "next": [
        "rub_pork"
      ],
      "on_enter": [
        {
          "say": "Right, let's get started by mixing our spices together. Imagine the lovely aroma of paprika and garlic filling the air!"
        }
      ]
    },
    {
      "id": "rub_pork",
      "descr": "Rub spice mix all over pork shoulder",
      "instructions": "Rub spice mix all over pork shoulder",
      "type": "immediate",
      "auto_start": false,
      "requires_confirm": true,
      "depends_on": [
        "mix_spice_rub"
      ],
      "next": [
        "slow_cook_pork"
      ],
      "on_enter": [
        {
          "say": "Now, let's give that pork shoulder a good rub with our spice mix. Make sure it's all covered for maximum flavour!"
        }
      ]
    },
    {
      "id": "slow_cook_pork",
      "descr": "Slow cook at 120\u00b0C for 5-6 hours until tender",
      "instructions": "Slow cook at 120\u00b0C for 5-6 hours until tender",
      "type": "timer",
      "duration": "PT5H",
      "auto_start": false,
      "requires_confirm": true,
      "depends_on": [
        "rub_pork"
      ],
      "next": [
        "shred_pork"
      ],
      "on_enter": [
        {
          "say": "Let's pop that pork into the oven at one hundred twenty degrees celsius. We'll let it cook low and slow for about five to six hours until it's beautifully tender."
        }
      ]
    },
    {
      "id": "shred_pork",
      "descr": "Shred pork with two forks",
      "instructions": "Shred pork with two forks",
      "type": "immediate",
      "auto_start": false,
      "requires_confirm": true,
      "depends_on": [
        "slow_cook_pork"
      ],
      "next": [
        "mix_bbq_sauce"
      ],
      "on_enter": [
        {
          "say": "Brilliant! Now that our pork is tender, let's shred it up with two forks. You'll see it just falls apart beautifully."
        }
      ]
    },
    {
      "id": "mix_bbq_sauce",
      "descr": "Mix with BBQ sauce",
      "instructions": "Mix with BBQ sauce",
      "type": "immediate",
      "auto_start": false,
      "requires_confirm": true,
      "depends_on": [
        "shred_pork"
      ],
      "next": [
        "pile_on_buns"
      ],
      "on_enter": [
        {
          "say": "Time to add some tangy BBQ sauce to our shredded pork. Give it a good mix so every bit is coated in that lovely sauce."
        }
      ]
    },
    {
      "id": "pile_on_buns",
      "descr": "Pile onto toasted buns",
      "instructions": "Pile onto toasted buns",
      "type": "immediate",
      "auto_start": false,
      "requires_confirm": true,
      "depends_on": [
        "mix_bbq_sauce"
      ],
      "next": [
        "top_with_coleslaw"
      ],
      "on_enter": [
        {
          "say": "Let's pile that delicious pork onto our toasted buns. It's going to be a real treat!"
        }
      ]
    },
    {
      "id": "top_with_coleslaw",
      "descr": "Top with coleslaw and serve",
      "instructions": "Top with coleslaw and serve",
      "type": "immediate",
      "auto_start": false,
      "requires_confirm": false,
      "depends_on": [
        "pile_on_buns"
      ],
      "next": [],
      "on_enter": [
        {
          "say": "Finally, top it off with some fresh coleslaw and you're ready to serve. Enjoy your pulled pork sandwich!"
        }
      ]
    }
  ],
  "events": {
    "tts_voice": "chef_friendly",
    "reminder_default": {
      "every": "PT30S"
    }
  },
  "notes": {
    "text": "Low and slow is the secret\nCan also use a slow cooker\nLeftovers freeze beautifully"
  }
}