{
  "recipe": {
    "id": "chicken-caesar-salad",
    "title": "Chicken Caesar Salad",
    "description": "Crisp romaine with grilled chicken, parmesan, and creamy dressing",
    "estimated_total": "PT20M",
    "locale": "en",
    "source": "pdf",
    "servings": 4,
    "difficulty": "Not Too Tricky",
    "tags": [
      "chicken",
      "italian",
      "dessert",
      "salad"
    ],
    "course": "salad",
    "cuisine": "italian"
  },
  "ingredients": [
    {
      "id": "breasts",
      "name": "breasts",
      "quantity": 2.0,
      "unit": "chicken"
    },
    {
      "id": "lettuce_heads",
      "name": "lettuce heads",
      "quantity": 2.0,
      "unit": "romaine"
    },
    {
      "id": "parmesan_shaved",
      "name": "Parmesan, shaved",
      "quantity": 100.0,
      "unit": "g"
    },
    {
      "id": "croutons",
      "name": "Croutons",
      "quantity": null,
      "unit": null
    },
    {
      "id": "mayonnaise",
      "name": "mayonnaise",
      "quantity": 3.0,
      "unit": "tbsp"
    },
    {
      "id": "dijon_mustard",
      "name": "Dijon mustard",
      "quantity": 1.0,
      "unit": "tbsp"
    },
    {
      "id": "cloves_minced",
      "name": "cloves, minced",
      "quantity": 2.0,
      "unit": "garlic"
    },
    {
      "id": "lemon_juice_worcestershire_sauce",
      "name": "Lemon juice, Worcestershire sauce",
      "quantity": null,
      "unit": null
    }
  ],
  "utensils": [],
  "steps": [
    {
      "id": "step_1",
      "descr": "Grill or pan-fry chicken breasts, season well",
      "instructions": "Grill or pan-fry chicken breasts, season well",
      "type": "immediate",
      "auto_start": false,
      "requires_confirm": false,
      "depends_on": [],
      "next": [
        "step_2"
      ],
      "on_enter": [
        {
          "say": "Time to grill the or pan-fry chicken."
        }
      ]
    },
    {
      "id": "step_2",
      "descr": "Make dressing: mix mayo, mustard, garlic, lemon juice, Worcestershire",
      "instructions": "Make dressing: mix mayo, mustard, garlic, lemon juice, Worcestershire",
      "type": "immediate",
      "auto_start": true,
      "requires_confirm": false,
      "depends_on": [
        "step_1"
      ],
      "next": [
        "step_3"
      ],
      "on_enter": [
        {
          "say": "Let's make dressing: mix mayo,."
        }
      ]
    },
    {
      "id": "step_3",
      "descr": "Tear lettuce into bite-sized pieces",
      "instructions": "Tear lettuce into bite-sized pieces",
      "type": "immediate",
      "auto_start": true,
      "requires_confirm": false,
      "depends_on": [
        "step_2"
      ],
      "next": [
        "step_4"
      ],
      "on_enter": [
        {
          "say": "Let's tear lettuce into bite-sized pieces."
        }
      ]
    },
    {
      "id": "step_4",
      "descr": "Slice cooked chicken",
      "instructions": "Slice cooked chicken",
      "type": "immediate",
      "auto_start": true,
      "requires_confirm": false,
      "depends_on": [
        "step_3"
      ],
      "next": [
        "step_5"
      ],
      "on_enter": [
        {
          "say": "Let's start by slice."
        }
      ]
    },
    {
      "id": "step_5",
      "descr": "Toss lettuce with dressing",
      "instructions": "Toss lettuce with dressing",
      "type": "immediate",
      "auto_start": true,
      "requires_confirm": false,
      "depends_on": [
        "step_4"
      ],
      "next": [
        "step_6"
      ],
      "on_enter": [
        {
          "say": "Let's toss everything together."
        }
      ]
    },
    {
      "id": "step_6",
      "descr": "Top with chicken, Parmesan, and croutons",
      "instructions": "Top with chicken, Parmesan, and croutons",
      "type": "immediate",
      "auto_start": true,
      "requires_confirm": false,
      "depends_on": [
        "step_5"
      ],
      "next": [
        "step_7"
      ],
      "on_enter": [
        {
          "say": "Let's top with chicken, parmesan, and croutons."
        }
      ]
    },
    {
      "id": "step_7",
      "descr": "Serve immediately",
      "instructions": "Serve immediately",
      "type": "immediate",
      "auto_start": true,
      "requires_confirm": false,
      "depends_on": [
        "step_6"
      ],
      "next": [],
      "on_enter": [
        {
          "say": "Time to serve and enjoy!"
        }
      ]
    }
  ],
  "events": {
    "tts_voice": "chef_friendly",
    "reminder_default": {
      "every": "PT30S"
    }
  },
  "notes": {
    "text": "The dressing should be bold and garlicky\nMake your own croutons for best results\nAdd anchovies for authentic flavor"
  }
}