{
  "recipe": {
    "id": "beef-ramen",
    "title": "Beef Ramen",
    "description": "Rich, flavorful Japanese noodle soup with tender beef",
    "estimated_total": "PT45M",
    "locale": "en",
    "source": "pdf",
    "servings": 4,
    "difficulty": "Medium",
    "tags": [
      "beef",
      "quick",
      "soup",
      "japanese"
    ],
    "course": "soup",
    "cuisine": "japanese"
  },
  "ingredients": [
    {
      "id": "ramen_noodles",
      "name": "ramen noodles",
      "quantity": 400.0,
      "unit": "g"
    },
    {
      "id": "beef_sirloin_sliced",
      "name": "beef sirloin, sliced",
      "quantity": 300.0,
      "unit": "g"
    },
    {
      "id": "beef_stock",
      "name": "beef stock",
      "quantity": 1.5,
      "unit": "L"
    },
    {
      "id": "soy_sauce",
      "name": "soy sauce",
      "quantity": 3.0,
      "unit": "tbsp"
    },
    {
      "id": "miso_paste",
      "name": "miso paste",
      "quantity": 2.0,
      "unit": "tbsp"
    },
    {
      "id": "4_soft-boiled_eggs",
      "name": "4 soft-boiled eggs",
      "quantity": null,
      "unit": null
    },
    {
      "id": "spring_onions_sliced",
      "name": "Spring onions, sliced",
      "quantity": null,
      "unit": null
    },
    {
      "id": "nori_sheets",
      "name": "Nori sheets",
      "quantity": null,
      "unit": null
    }
  ],
  "utensils": [],
  "steps": [
    {
      "id": "simmer_stock",
      "descr": "Bring beef stock to simmer, add soy sauce and miso",
      "instructions": "Bring beef stock to simmer, add soy sauce and miso",
      "type": "immediate",
      "auto_start": true,
      "requires_confirm": true,
      "depends_on": [],
      "next": [
        "cook_noodles"
      ],
      "on_enter": [
        {
          "say": "Let's get started by bringing our beef stock to a gentle simmer. Add in the soy sauce and miso, and give it a good stir. You'll know it's ready when you can smell that lovely umami aroma."
        }
      ]
    },
    {
      "id": "cook_noodles",
      "descr": "Cook noodles according to package",
      "instructions": "Cook noodles according to package",
      "type": "immediate",
      "auto_start": false,
      "requires_confirm": true,
      "depends_on": [
        "simmer_stock"
      ],
      "next": [
        "sear_beef"
      ],
      "on_enter": [
        {
          "say": "Time to cook the noodles. Follow the package instructions and make sure they're just right - not too soft, not too firm. Perfect!"
        }
      ]
    },
    {
      "id": "sear_beef",
      "descr": "Sear beef slices quickly in a hot pan",
      "instructions": "Sear beef slices quickly in a hot pan",
      "type": "immediate",
      "auto_start": false,
      "requires_confirm": true,
      "depends_on": [
        "cook_noodles"
      ],
      "next": [
        "divide_noodles"
      ],
      "on_enter": [
        {
          "say": "Now, let's sear those beef slices in a hot pan. You want them to be beautifully browned on the outside while still tender inside. Listen for that sizzle!"
        }
      ]
    },
    {
      "id": "divide_noodles",
      "descr": "Divide noodles between bowls",
      "instructions": "Divide noodles between bowls",
      "type": "immediate",
      "auto_start": false,
      "requires_confirm": true,
      "depends_on": [
        "sear_beef"
      ],
      "next": [
        "ladle_broth"
      ],
      "on_enter": [
        {
          "say": "Let's divide those lovely noodles between your serving bowls. Make sure each bowl gets a fair share."
        }
      ]
    },
    {
      "id": "ladle_broth",
      "descr": "Ladle hot broth over noodles",
      "instructions": "Ladle hot broth over noodles",
      "type": "immediate",
      "auto_start": false,
      "requires_confirm": true,
      "depends_on": [
        "divide_noodles"
      ],
      "next": [
        "add_toppings"
      ],
      "on_enter": [
        {
          "say": "Now, ladle that hot, flavorful broth over the noodles. This is where the magic happens!"
        }
      ]
    },
    {
      "id": "add_toppings",
      "descr": "Top with beef, halved eggs, spring onions, nori",
      "instructions": "Top with beef, halved eggs, spring onions, nori",
      "type": "immediate",
      "auto_start": false,
      "requires_confirm": true,
      "depends_on": [
        "ladle_broth"
      ],
      "next": [
        "serve_dish"
      ],
      "on_enter": [
        {
          "say": "Let's finish it off by topping with the seared beef, halved soft-boiled eggs, sliced spring onions, and a bit of nori. It's going to look and taste fantastic!"
        }
      ]
    },
    {
      "id": "serve_dish",
      "descr": "Serve immediately while hot",
      "instructions": "Serve immediately while hot",
      "type": "immediate",
      "auto_start": false,
      "requires_confirm": false,
      "depends_on": [
        "add_toppings"
      ],
      "next": [],
      "on_enter": [
        {
          "say": "Time to serve and enjoy your delicious beef ramen while it's hot. Dig in and savour every bite!"
        }
      ]
    }
  ],
  "events": {
    "tts_voice": "chef_friendly",
    "reminder_default": {
      "every": "PT30S"
    }
  },
  "notes": {
    "text": "Don't overcook the eggs - yolks should be jammy\nAdd chili oil for extra heat\nGarnish generously"
  }
}