{
  "recipe": {
    "id": "shepherds-pie",
    "title": "Shepherd's Pie",
    "description": "Comforting British classic with lamb mince and mashed potato",
    "estimated_total": "PT1H",
    "locale": "en",
    "source": "pdf",
    "servings": 6,
    "difficulty": "Medium",
    "tags": [
      "dessert"
    ],
    "course": "dessert"
  },
  "ingredients": [
    {
      "id": "lamb_mince",
      "name": "lamb mince",
      "quantity": 500.0,
      "unit": "g"
    },
    {
      "id": "1_onion_diced",
      "name": "1 onion, diced",
      "quantity": null,
      "unit": null
    },
    {
      "id": "2_carrots_diced",
      "name": "2 carrots, diced",
      "quantity": null,
      "unit": null
    },
    {
      "id": "tomato_pur\u0000e9e",
      "name": "tomato pur\u0000e9e",
      "quantity": 2.0,
      "unit": "tbsp"
    },
    {
      "id": "lamb_stock",
      "name": "lamb stock",
      "quantity": 300.0,
      "unit": "ml"
    },
    {
      "id": "potatoes",
      "name": "potatoes",
      "quantity": 1.0,
      "unit": "kg"
    },
    {
      "id": "butter",
      "name": "butter",
      "quantity": 50.0,
      "unit": "g"
    },
    {
      "id": "milk",
      "name": "milk",
      "quantity": 100.0,
      "unit": "ml"
    }
  ],
  "utensils": [],
  "steps": [
    {
      "id": "brown_lamb",
      "descr": "Brown lamb mince, add onion and carrots",
      "instructions": "Brown lamb mince, add onion and carrots",
      "type": "immediate",
      "auto_start": true,
      "requires_confirm": true,
      "depends_on": [],
      "next": [
        "simmer_sauce"
      ],
      "on_enter": [
        {
          "say": "Alright, let's get started by browning the lamb mince. Once it's nice and brown, we'll add in the onion and carrots. You'll know it's ready when the kitchen starts to smell amazing!"
        }
      ]
    },
    {
      "id": "simmer_sauce",
      "descr": "Stir in tomato pur\u00e9e and stock, simmer 20 mins",
      "instructions": "Stir in tomato pur\u00e9e and stock, simmer 20 mins",
      "type": "timer",
      "duration": "PT20M",
      "auto_start": false,
      "requires_confirm": true,
      "depends_on": [
        "brown_lamb"
      ],
      "next": [
        "boil_potatoes"
      ],
      "on_enter": [
        {
          "say": "Now, let's stir in the tomato pur\u00e9e and stock. Give it a good mix and then we'll let it simmer for twenty minutes. This is where all those lovely flavors come together!"
        }
      ]
    },
    {
      "id": "boil_potatoes",
      "descr": "Boil potatoes until tender",
      "instructions": "Boil potatoes until tender",
      "type": "immediate",
      "auto_start": false,
      "requires_confirm": true,
      "depends_on": [
        "simmer_sauce"
      ],
      "next": [
        "mash_potatoes"
      ],
      "on_enter": [
        {
          "say": "Let's get those potatoes boiling until they're nice and tender. You want them soft enough to mash easily."
        }
      ]
    },
    {
      "id": "mash_potatoes",
      "descr": "Mash with butter and milk until smooth",
      "instructions": "Mash with butter and milk until smooth",
      "type": "immediate",
      "auto_start": false,
      "requires_confirm": true,
      "depends_on": [
        "boil_potatoes"
      ],
      "next": [
        "transfer_meat"
      ],
      "on_enter": [
        {
          "say": "Time to mash those potatoes! Add in the butter and milk, and mash until they're smooth and creamy. This is going to be the perfect topping for our pie."
        }
      ]
    },
    {
      "id": "transfer_meat",
      "descr": "Transfer meat to baking dish",
      "instructions": "Transfer meat to baking dish",
      "type": "immediate",
      "auto_start": false,
      "requires_confirm": true,
      "depends_on": [
        "mash_potatoes"
      ],
      "next": [
        "top_with_potato"
      ],
      "on_enter": [
        {
          "say": "Now, let's transfer that lovely meat mixture into a baking dish. Make sure to spread it out evenly."
        }
      ]
    },
    {
      "id": "top_with_potato",
      "descr": "Top with mashed potato, fork patterns on top",
      "instructions": "Top with mashed potato, fork patterns on top",
      "type": "immediate",
      "auto_start": false,
      "requires_confirm": true,
      "depends_on": [
        "transfer_meat"
      ],
      "next": [
        "bake_pie"
      ],
      "on_enter": [
        {
          "say": "Let's spoon the mashed potato over the meat. Use a fork to create some lovely patterns on top. This will help it crisp up beautifully in the oven."
        }
      ]
    },
    {
      "id": "bake_pie",
      "descr": "Bake at 200\u00b0C for 25 minutes until golden",
      "instructions": "Bake at 200\u00b0C for 25 minutes until golden",
      "type": "timer",
      "duration": "PT25M",
      "auto_start": false,
      "requires_confirm": false,
      "depends_on": [
        "top_with_potato"
      ],
      "next": [],
      "on_enter": [
        {
          "say": "Alright, let's pop that into the oven at two hundred degrees celsius for twenty-five minutes. We're looking for a beautiful golden top. Can't wait to dig in!"
        }
      ]
    }
  ],
  "events": {
    "tts_voice": "chef_friendly",
    "reminder_default": {
      "every": "PT30S"
    }
  },
  "notes": {
    "text": "Use beef mince for cottage pie\nAdd worcestershire sauce for depth\nFreeze individual portions for easy meals"
  }
}