{
  "notes": {
    "text": "Toast pine nuts for deeper flavor\nPesto can be made ahead and frozen\nAdd a splash of lemon juice for brightness"
  },
  "steps": [
    {
      "id": "cook_pasta",
      "next": [
        "blend_pesto"
      ],
      "type": "immediate",
      "descr": "Cook pasta in salted boiling water",
      "on_enter": [
        {
          "say": "Right, let's get started by cooking our pasta in a big pot of salted boiling water. It should be bubbling away nicely!"
        }
      ],
      "auto_start": false,
      "depends_on": [],
      "instructions": "Cook pasta in salted boiling water",
      "requires_confirm": true
    },
    {
      "id": "blend_pesto",
      "next": [
        "add_olive_oil"
      ],
      "type": "immediate",
      "descr": "Blend basil, pine nuts, garlic, and Parmesan",
      "on_enter": [
        {
          "say": "Now, let's make our beautiful pesto. Pop the basil, pine nuts, garlic, and Parmesan into a blender. Give it a whizz until it's all combined."
        }
      ],
      "auto_start": true,
      "depends_on": [
        "cook_pasta"
      ],
      "instructions": "Blend basil, pine nuts, garlic, and Parmesan",
      "requires_confirm": true
    },
    {
      "id": "add_olive_oil",
      "next": [
        "season_pesto"
      ],
      "type": "immediate",
      "descr": "Drizzle in olive oil while blending",
      "on_enter": [
        {
          "say": "Lovely! Now, while the blender is running, slowly drizzle in the olive oil. You'll see it turn into a smooth, luscious sauce."
        }
      ],
      "auto_start": true,
      "depends_on": [
        "blend_pesto"
      ],
      "instructions": "Drizzle in olive oil while blending",
      "requires_confirm": true
    },
    {
      "id": "season_pesto",
      "next": [
        "drain_pasta"
      ],
      "type": "immediate",
      "descr": "Season pesto with salt and pepper",
      "on_enter": [
        {
          "say": "Time to season our pesto. Add a pinch of salt and a good grind of pepper. Taste it to make sure it's just right."
        }
      ],
      "auto_start": true,
      "depends_on": [
        "add_olive_oil"
      ],
      "instructions": "Season pesto with salt and pepper",
      "requires_confirm": true
    },
    {
      "id": "drain_pasta",
      "next": [
        "toss_pasta"
      ],
      "type": "immediate",
      "descr": "Reserve pasta water, drain pasta",
      "on_enter": [
        {
          "say": "Let's reserve a cup of that starchy pasta water, then drain the pasta. This water will help us get the perfect sauce consistency."
        }
      ],
      "auto_start": true,
      "depends_on": [
        "season_pesto"
      ],
      "instructions": "Reserve pasta water, drain pasta",
      "requires_confirm": true
    },
    {
      "id": "toss_pasta",
      "next": [
        "serve_pasta"
      ],
      "type": "immediate",
      "descr": "Toss pasta with pesto, add pasta water to loosen",
      "on_enter": [
        {
          "say": "Now, let's toss the pasta with our fresh pesto. Add a splash of the reserved pasta water to loosen it up. It should look glossy and delicious!"
        }
      ],
      "auto_start": true,
      "depends_on": [
        "drain_pasta"
      ],
      "instructions": "Toss pasta with pesto, add pasta water to loosen",
      "requires_confirm": true
    },
    {
      "id": "serve_pasta",
      "next": [],
      "type": "immediate",
      "descr": "Serve with halved cherry tomatoes and extra Parmesan",
      "on_enter": [
        {
          "say": "Time to plate up! Serve your pasta with some halved cherry tomatoes and a sprinkle of extra Parmesan. Enjoy your meal!"
        }
      ],
      "auto_start": true,
      "depends_on": [
        "toss_pasta"
      ],
      "instructions": "Serve with halved cherry tomatoes and extra Parmesan",
      "requires_confirm": false
    }
  ],
  "events": {
    "tts_voice": "chef_friendly",
    "reminder_default": {
      "every": "PT30S"
    }
  },
  "recipe": {
    "id": "pesto-pasta",
    "tags": [
      "pasta",
      "italian"
    ],
    "title": "Pesto Pasta",
    "course": "main",
    "locale": "en",
    "source": "pdf",
    "cuisine": "italian",
    "servings": 4,
    "difficulty": "Not Too Tricky",
    "description": "Simple pasta with fresh basil pesto and Parmesan",
    "estimated_total": "PT20M"
  },
  "utensils": [],
  "ingredients": [
    {
      "id": "pasta",
      "name": "pasta",
      "unit": "g",
      "quantity": 400.0
    },
    {
      "id": "fresh_basil",
      "name": "fresh basil",
      "unit": "g",
      "quantity": 100.0
    },
    {
      "id": "pine_nuts",
      "name": "pine nuts",
      "unit": "g",
      "quantity": 50.0
    },
    {
      "id": "cloves",
      "name": "cloves",
      "unit": "garlic",
      "quantity": 2.0
    },
    {
      "id": "parmesan_grated",
      "name": "Parmesan, grated",
      "unit": "g",
      "quantity": 100.0
    },
    {
      "id": "olive_oil",
      "name": "olive oil",
      "unit": "ml",
      "quantity": 150.0
    },
    {
      "id": "salt_and_pepper",
      "name": "Salt and pepper",
      "unit": null,
      "quantity": null
    },
    {
      "id": "cherry_tomatoes",
      "name": "Cherry tomatoes",
      "unit": null,
      "quantity": null
    }
  ]
}