{
  "recipe": {
    "id": "chicken-caesar-salad",
    "title": "Chicken Caesar Salad",
    "description": "Crisp romaine with grilled chicken, parmesan, and creamy dressing",
    "estimated_total": "PT20M",
    "locale": "en",
    "source": "pdf",
    "servings": 4,
    "difficulty": "Not Too Tricky",
    "tags": [
      "chicken",
      "italian",
      "salad"
    ],
    "course": "salad",
    "cuisine": "italian"
  },
  "ingredients": [
    {
      "id": "breasts",
      "name": "breasts",
      "quantity": 2.0,
      "unit": "chicken"
    },
    {
      "id": "lettuce_heads",
      "name": "lettuce heads",
      "quantity": 2.0,
      "unit": "romaine"
    },
    {
      "id": "parmesan_shaved",
      "name": "Parmesan, shaved",
      "quantity": 100.0,
      "unit": "g"
    },
    {
      "id": "croutons",
      "name": "Croutons",
      "quantity": null,
      "unit": null
    },
    {
      "id": "mayonnaise",
      "name": "mayonnaise",
      "quantity": 3.0,
      "unit": "tbsp"
    },
    {
      "id": "dijon_mustard",
      "name": "Dijon mustard",
      "quantity": 1.0,
      "unit": "tbsp"
    },
    {
      "id": "cloves_minced",
      "name": "cloves, minced",
      "quantity": 2.0,
      "unit": "garlic"
    },
    {
      "id": "lemon_juice_worcestershire_sauce",
      "name": "Lemon juice, Worcestershire sauce",
      "quantity": null,
      "unit": null
    }
  ],
  "utensils": [],
  "steps": [
    {
      "id": "grill_chicken",
      "descr": "Grill or pan-fry chicken breasts, season well",
      "instructions": "Grill or pan-fry chicken breasts, season well",
      "type": "immediate",
      "auto_start": true,
      "requires_confirm": true,
      "depends_on": [],
      "next": [
        "make_dressing"
      ],
      "on_enter": [
        {
          "say": "Right, let's get started by grilling or pan-frying those chicken breasts. Season them well and cook until they're beautifully golden and cooked through."
        }
      ]
    },
    {
      "id": "make_dressing",
      "descr": "Make dressing: mix mayo, mustard, garlic, lemon juice, Worcestershire",
      "instructions": "Make dressing: mix mayo, mustard, garlic, lemon juice, Worcestershire",
      "type": "immediate",
      "auto_start": false,
      "requires_confirm": true,
      "depends_on": [
        "grill_chicken"
      ],
      "next": [
        "tear_lettuce"
      ],
      "on_enter": [
        {
          "say": "Now, let's whip up that dressing. Mix together the mayonnaise, mustard, minced garlic, a squeeze of lemon juice, and a dash of Worcestershire sauce. Give it a good stir until it's smooth and creamy."
        }
      ]
    },
    {
      "id": "tear_lettuce",
      "descr": "Tear lettuce into bite-sized pieces",
      "instructions": "Tear lettuce into bite-sized pieces",
      "type": "immediate",
      "auto_start": false,
      "requires_confirm": true,
      "depends_on": [
        "make_dressing"
      ],
      "next": [
        "slice_chicken"
      ],
      "on_enter": [
        {
          "say": "Let's prepare the lettuce. Tear those lovely romaine leaves into bite-sized pieces. They should look fresh and crisp."
        }
      ]
    },
    {
      "id": "slice_chicken",
      "descr": "Slice cooked chicken",
      "instructions": "Slice cooked chicken",
      "type": "immediate",
      "auto_start": false,
      "requires_confirm": true,
      "depends_on": [
        "tear_lettuce"
      ],
      "next": [
        "toss_lettuce"
      ],
      "on_enter": [
        {
          "say": "Time to slice up the chicken. Make sure it's nice and juicy, and slice it into thin, even pieces."
        }
      ]
    },
    {
      "id": "toss_lettuce",
      "descr": "Toss lettuce with dressing",
      "instructions": "Toss lettuce with dressing",
      "type": "immediate",
      "auto_start": false,
      "requires_confirm": true,
      "depends_on": [
        "slice_chicken"
      ],
      "next": [
        "top_salad"
      ],
      "on_enter": [
        {
          "say": "Let's toss the lettuce with that gorgeous dressing. Make sure every leaf is coated for maximum flavour."
        }
      ]
    },
    {
      "id": "top_salad",
      "descr": "Top with chicken, Parmesan, and croutons",
      "instructions": "Top with chicken, Parmesan, and croutons",
      "type": "immediate",
      "auto_start": false,
      "requires_confirm": true,
      "depends_on": [
        "toss_lettuce"
      ],
      "next": [
        "serve_salad"
      ],
      "on_enter": [
        {
          "say": "Now, let's finish it off by topping the salad with the sliced chicken, some shaved Parmesan, and a handful of croutons. It's looking fantastic!"
        }
      ]
    },
    {
      "id": "serve_salad",
      "descr": "Serve immediately",
      "instructions": "Serve immediately",
      "type": "immediate",
      "auto_start": false,
      "requires_confirm": false,
      "depends_on": [
        "top_salad"
      ],
      "next": [],
      "on_enter": [
        {
          "say": "Brilliant! It's time to serve up your Chicken Caesar Salad. Enjoy every bite!"
        }
      ]
    }
  ],
  "events": {
    "tts_voice": "chef_friendly",
    "reminder_default": {
      "every": "PT30S"
    }
  },
  "notes": {
    "text": "The dressing should be bold and garlicky\nMake your own croutons for best results\nAdd anchovies for authentic flavor"
  }
}